{
  "schemaVersion": "1.0",
  "reportId": "bbbbbbbb-0000-4000-8000-000000000006",
  "period": {
    "from": "2026-10-05T23:59:59Z",
    "to": "2026-10-05T23:59:59Z"
  },
  "generatedAt": "2026-10-06T00:00:00Z",
  "source": "manual",
  "status": "actual",
  "currency": "ISK",
  "provenance": "historical_seed",
  "notes": "Synthetic public demo fixture; no actual account, wallet or production observation. Never counted as current income.",
  "pillar": "trading",
  "reportType": "snapshot",
  "data": {
    "kind": "TradingSnapshotReport",
    "wallet": 1234567.89,
    "buyEscrow": 0,
    "openBuyOrders": 0,
    "openSellOrders": 3,
    "inventoryCostBasis": "not_reported",
    "sellOrderCostBasis": "not_reported",
    "openSellOrderAskValue": "not_reported"
  }
}
