{
  "schemaVersion": "1.0",
  "reportId": "eeeeeeee-0000-4000-8000-000000000006",
  "pillar": "industry",
  "reportType": "plan",
  "period": {
    "from": "2026-10-05T00:00:00+02:00",
    "to": "2026-10-05T23:59:59+02:00"
  },
  "generatedAt": "2026-10-06T00:00:00+02:00",
  "source": "agent",
  "status": "plan",
  "currency": "ISK",
  "provenance": "historical_seed",
  "notes": "Vorlage, nicht automatisch geladen. Vor Verwendung ID, Zeitraum, provenance und Messwerte ersetzen; kein Ist-Fakt.",
  "data": {
    "operationalStatus": "planning",
    "jobs": [],
    "reactions": [],
    "realizedRevenue": "not_reported",
    "materialCosts": "not_reported",
    "jobFees": "not_reported",
    "structureFees": "not_reported",
    "logisticsCosts": "not_reported",
    "netProfit": "not_reported",
    "plexContribution": "not_reported"
  }
}
