{
  "schemaVersion": "1.0",
  "reportId": "eeeeeeee-0000-4000-8000-000000000008",
  "pillar": "coordinator",
  "reportType": "snapshot",
  "period": {
    "from": "2026-10-05T23:59:59+02:00",
    "to": "2026-10-05T23:59:59+02:00"
  },
  "generatedAt": "2026-10-06T00:00:00+02:00",
  "source": "agent",
  "status": "actual",
  "currency": "ISK",
  "provenance": "historical_seed",
  "notes": "Vorlage, nicht automatisch geladen. Vor Verwendung ID, Zeitraum, provenance und Messwerte ersetzen; kein Ist-Fakt.",
  "data": {
    "physicalPlex": "not_reported",
    "freeLiquidity": "not_reported",
    "capitalBound": "not_reported",
    "realizedProfitByPillar": {
      "mining": "not_reported",
      "pi": "not_reported",
      "trading": "not_reported",
      "industry": "not_reported",
      "supplementary": "not_reported"
    },
    "plexContributionByPillar": {},
    "totalRealizedProfit": "not_reported",
    "plexPrice": {
      "iskPerPlex": "not_reported"
    },
    "sixMonthTarget": {
      "plex": 7875
    },
    "twelveMonthTarget": {
      "plex": 13500
    },
    "openIssues": [
      "Keine gemessenen Ist-Werte in dieser Vorlage"
    ]
  }
}
