{
  "schemaVersion": "1.0",
  "reportId": "eeeeeeee-0000-4000-8000-000000000004",
  "pillar": "trading",
  "reportType": "snapshot",
  "period": {
    "from": "2026-10-05T23:59:59+02:00",
    "to": "2026-10-05T23:59:59+02:00"
  },
  "generatedAt": "2026-10-06T00:00:00+02:00",
  "source": "agent",
  "status": "actual",
  "currency": "ISK",
  "provenance": "historical_seed",
  "notes": "Vorlage, nicht automatisch geladen. Vor Verwendung ID, Zeitraum, provenance und Messwerte ersetzen; kein Ist-Fakt.",
  "data": {
    "wallet": "not_reported",
    "escrow": "not_reported",
    "openBuyOrders": "not_reported",
    "openSellOrders": "not_reported",
    "sellOrdersGross": "not_reported",
    "inventoryValue": "not_reported",
    "freeOrderSlots": "not_reported",
    "capitalBound": "not_reported",
    "freeLiquidity": "not_reported"
  }
}
