{
  "schemaVersion": "1.0",
  "reportId": "eeeeeeee-0000-4000-8000-000000000007",
  "pillar": "supplementary",
  "reportType": "daily",
  "period": {
    "from": "2026-10-05T00:00:00+02:00",
    "to": "2026-10-05T23:59:59+02:00"
  },
  "generatedAt": "2026-10-06T00:00:00+02:00",
  "source": "agent",
  "status": "actual",
  "currency": "ISK",
  "provenance": "historical_seed",
  "notes": "Vorlage, nicht automatisch geladen. Vor Verwendung ID, Zeitraum, provenance und Messwerte ersetzen; kein Ist-Fakt.",
  "data": {
    "activities": [
      {
        "category": "ratting",
        "grossRevenue": "not_reported",
        "directCosts": "not_reported",
        "netProfit": "not_reported",
        "sourceTransactionIds": []
      }
    ],
    "plexContribution": "not_reported"
  }
}
